<?xml version="1.0" encoding="UTF-8" standalone="yes"?>
<xs:schema version="1.0" xmlns:xs="http://www.w3.org/2001/XMLSchema">
    <xs:element name="products">
        <xs:complexType>
            <xs:sequence>
                <xs:element name="product" maxOccurs="unbounded" type="product">
                </xs:element>
            </xs:sequence>
        </xs:complexType>
    </xs:element>

    <xs:complexType name="product">
        <xs:sequence>
            <xs:element name="name" type="xs:string"/>
            <xs:element name="buildtime" type="buildtime"/>
            <xs:element name="price" type="europrice"/>
        </xs:sequence>
        <xs:attribute name="id" type="xs:int"/>
    </xs:complexType>

    <xs:simpleType name="buildtime">
        <xs:restriction base="xs:string">
            <xs:pattern value="[0-9]{2}:[0-9]{2}:[0-9]{2}"></xs:pattern>
        </xs:restriction>
    </xs:simpleType>

    <xs:simpleType name="europrice">
        <xs:restriction base="xs:string">
            <xs:pattern value="[.0-9]{1,20}.[0-9]{2} â‚¬"></xs:pattern>
        </xs:restriction>
    </xs:simpleType>
</xs:schema>